,en,ru
0,"Needless to say, when it's kluged together like this, there were a lot of trials and tribulations getting this working.","Понятно, что когда все было собрано вот так, потребовалось пройти много испытаний и злоключений, чтобы заставить это работать."
1,Public agenda did a survey for us a couple of years ago where they found that 43 percent of the high school teachers in America say that they spend at least half of their time maintaining order in the classroom.,"Фонд общественного мнения ""Public Agenda"" пару лет назад сделали для нас опрос, где выяснилось, что 43 процента учителей в старших школах в Америке говорят, что минимум половина учебного времени у них уходит на поддержание порядка в классе."
2,It can be that people don't want to associate with anyone who won't or can't fit themselves into a box that's labeled normal.,"Бывает, что люди не хотят сближаться с тем, кто не хочет или не может уложиться в коробку с этикеткой « нормальный »."
3,"Let us free ourselves — especially in the West — from thinking about that part of the world based on oil interest, or based on interests of the illusion of stability and security.","Давайте освободимся - особенно на Западе- от стереотипов, представляя эту часть мира как зависящую от нефтяной конъюнктуры или живущую в иллюзиях стабильности и безопасности."
4,They are recruiting hackers both before and after they become involved in criminal and industrial espionage activities — are mobilizing them on behalf of the state.,Они нанимают хакеров до и после их вовлечения в криминал и промышленный шпионаж — их призывают на службу от имени государства.
5,"Now, we thought those data were so powerful, in a way, that we wanted to see what happened in the first six months of life, because if you interact with a two- and a three-month-old, you'd be surprised by how social those babies are.","Нам показалось, что эти данные так важны, что мы решили посмотреть, что произойдёт в первые шесть месяцев жизни, потому что если вы взаимодействуете с трёхмесячным младенцем, вы удивитесь, насколько они общительны."
6,"There are many cases, some of which I talk about in the book, of people who have been slandered, called Nazis, physically assaulted, threatened with criminal prosecution for stumbling across or arguing about controversial findings.","Есть много случаев, некоторые из которых я описываю в книге, когда люди были оклеветаны, названы нацистами, подвергались физическому насилию или уголовному преследованию за то, что они натолкнулись или отстаивают спорные открытия."
7,"Now, this is an image that we shot a couple of weeks ago for today, and you'll notice, on the edge of this image, there's some dark spots there, which was really concerning to me.","Эту картинку мы сняли пару недель назад, и как вы заметили, с краю на этой картинке есть тёмные пятна, которые меня беспокоят."
8,I was the type and the kind of religious where kids kill themselves every single year because they're terrified of coming out to our community as gay.,"Я принадлежала к религии, где каждый год молодые люди кончают жизнь самоубийством из-за страха, что их гомосексуальность будет обнаружена общиной."
9,"The challenge now, of course, is doing this on the scale needed right across these three countries, and that is a huge challenge.","Сейчас у нас другая задача — обеспечить эти условия в нужном масштабе на территории всех трёх стран, и это будет непросто."
10,It is the responsibility of everybody because it will determine what kind of planet and what kind of bodies we will have in the future.,"Это ответственность каждого, потому что речь идет о том, какая планета и какие существа ждут нас в будущем."
11,"It was really hard for me to find my voice, because I never felt I was enough — never Chinese, Dutch-Indonesian or Native enough.","Мне было сложно услышать свой собственный голос, потому что я не знала, кто я — китаянка, голландка, индонезийка или индианка."
12,"And liver will regenerate in this very nice way, but actually if we think of other tissues, like cartilage, for example, even the simplest nick and you're going to find it really difficult to regenerate your cartilage.","Если мы рассмотрим другие ткани, например, хрящ, то даже самая простая трещина затруднит ваши действия по восстановлению хряща."
13,What we learn with these students — these students have multiple disabilities and coping strategies that will be accommodated — what we learn with these students will directly impact the way things are being done at the professional level.,"Чему мы учимся с этими студентами — у них множественная инвалидность и разные методы адаптации, которые мы учитываем, — то, чему мы учимся с ними, будет непосредственно влиять на будущее положение дел на профессиональном уровне."
14,"It's what Coleridge called the willing suspension of disbelief or poetic faith, for those moments where a story, no matter how strange, has some semblance of the truth, and then you're able to believe it.","Это то, что Кольридж назвал отстранением от неверия или поэтической верой, в те моменты, когда история, даже очень странная, в какой-то степени похожа на правду, и тогда в неё получается поверить."
15,"And then we were able to test them rigorously, in random-assignment, placebo-controlled designs, throw out the things that didn't work, keep the things that actively did.",С помощью случайного распределения индифферентных факторов среди контрольных групп удалось отказаться от недейственных методов и оставить эффективные.
16,"When I did that, I had to use my bicep to get the hand to close, use my tricep to get it to open, cocontract again to get the elbow to work again.","После этого нужно было напрячь бицепс, чтобы сжать руку в кулак или трицепс, чтобы раскрыть кисть, снова сжать мышцы, чтобы заработал локоть."
17,"And of course the bear left, so what that teaches us is obstacles are to be expected and we can choose to surrender or we can stand and fight.","Конечно, медведь ушёл, и это учит нас, что несмотря на препятствия, мы можем решить сдаться или мы можем встать и сражаться."
18,"But when politics is only management of mistrust, then — I'm very glad that ""1984"" has been mentioned — now we're going to have ""1984"" in reverse.","Но когда политика заключается только в управлении недоверием, тогда — и я очень рад, что роман « 1984 » уже упоминался, — тогда у нас будет « 1984 » наоборот."
19,"And networks make it harder for people to do that, because they drive attention to the things that the network values.","И сети делают это всё более труднодостижимым для людей, потому что они привлекают внимание людей к тем вопросам, которые важны для сети."
20,"In the biological sciences, they explored the implications of the notion that order and complexity and structure arise in a self-organized way.","Биология последовательно делала выводы о роли самоорганизации при возникновении структур, порядка, сложности."
21,"To keep safe in my work, I try not to take bookings from someone who calls me from a withheld number.","Чтобы остаться целой и невредимой, я стараюсь не принимать заказы от тех, кто звонит со скрытого номера."
22,"But what struck me about them was that whenever her husband changed the baby's diaper, she said ""thank you"" to him.","Но меня больше всего поразило, что, когда её муж менял ребёнку подгузник, она говорила ему « Спасибо »."
23,So how do we present and justify that idea of global versus wholly nationalist to people in countries like Ghana and Nigeria and Togo and other countries like that?,"Поэтому что можно было бы сказать в защиту этой глобальной идеи в противовес чистому национализму людям в таких странах, как Гана, Нигерия, Того и подобным им странам? Спасибо."
24,"It would be a crime for all of us not to be aware when somebody shows up at a swimming pool and says one word, just one word, if you don't listen if that word is ""lifecode.""","Нельзя не замечать, что кто-то ведёт нас к бассейну и говорит одно только слово, и не услышать, что слово это — « жизненный код »."
25,"By seven months of gestation, the fetus' taste buds are fully developed, and its olfactory receptors, which allow it to smell, are functioning.","К седьмому месяцу беременности, вкусовые рецепторы плода полностью развиты и его обонятельная система уже функционирует."
26,"So if we were to have some kind of global governance, what makes you think it would end up being more like Denmark rather than more like Russia or Honduras, and aren't there alternatives, such as we did with CFCs?","Допустим, у нас будет некое глобальное правительство, почему вы думаете, что оно будет больше походить на Данию, чем на Россию или Гондурас, и разве нет альтернатив, таких как в случае с ХФУ?"
27,This is a reconstruction of Notre Dame Cathedral that was done entirely computationally from images scraped from Flickr.,"Это реконструкция собора Парижской Богоматери, полностью выполненная с помощью компьютера на основе изображений, собранных на сервисе Flickr."
28,So could you imagine ways of passively loading and unloading bone so that you can recreate or regenerate degenerating cartilage?,"Так есть ли способы пассивно нагружать и разгружать кости, чтобы можно было воссоздать разрушающийся хрящ?"
29,"And with them, we made sure that they understood how their day-to-day actions were impacting our ability as a country to create new jobs and to attract investments.","И вместе с ними мы убедились, что они поняли как их каждодневная работа влияла на наши возможности в стране создавать новые рабочие места и привлекать инвестиции."
30,"You can see it getting up into the mangrove, but it is not harming the corals or the sea grass, right.","Видно, как она продвигается к мангровым зарослям, но не приносит вреда кораллам или водорослям, вот так."
31,"And brace yourself, executives, because I'm going to be putting companies on the hot seat to step up and play the role that I know they can.","И держитесь, руководители, потому что я собираюсь заставить компании взять на себя роль, которую, я уверена, они смогут сыграть."
32,"Many years ago, when I was a young congressman, I spent an awful lot of time dealing with the challenge of nuclear arms control — the nuclear arms race.","Много лет назад, когда я был молодым конгрессменом, я уйму времени уделял вопросу контроля над ядерным оружием, гонки ядерных вооружений."
33,"And as the victims' families and the city and the country reeled in shock, investigators tried to find out who was responsible.","И пока семьи погибших, весь город и вся страна пребывали в шоке, следователи пытались найти виновных."
34,For nothing in my life's path would have predicted that I'd be standing here as the first African-American First Lady of the United States of America.,"Ведь я никогда в моей прежней жизни не предполагала, что буду стоять здесь в лице первой Афро-американской Первой Леди Соединённых Штатов Америки."
35,So those of you who recognized the first group of names know that these were African-Americans who have been killed by the police over the last two and a half years.,"Итак, те из вас, кто узнали первую группу имён, знают, что это имена афроамериканцев, убитых полицейскими за последние два с половиной года."
36,"If we love such moments ferociously, then maybe we can learn to live well — not in spite of death, but because of it.","Если мы так неистово любим эти моменты, то, вероятно, можно научиться жить лучше не вопреки смерти, а из-за неё."
37,Then there was the congregation who had left their usual church building on the shore to hold a service in the hills.,"А прихожане одной из церквей, вместо своей церкви, построенной на берегу, куда ходили всегда, решили пойти в другую, расположенную на холме."
38,"And if you look through the eye, or you look at the vessels on the white of the eye, in fact, you may be able to do this directly, without drawing any blood at all, or through your nail beds.","Если посмотреть сквозь глаз, или на сосуды на белке глаза, это можно сделать напрямую, совсем без забора крови, или же через лунки ногтя."
39,"When my little kids — when my kids were little — they're all grown now, I have grandkids — I used to go in and sit on the side of their bed, and I used to watch my kids sleep.","Когда мои маленькие дети были маленькими — сейчас они все выросли, у меня уже внуки — я бывало заходил и сидел на их кровати, и смотрел как они спят."
40,"And so I've stopped using words like ""form,"" and I've stopped using words like ""function"" as a designer.","Поэтому я перестал использовать слово « форма », и, как дизайнер, я перестал использовать такие слова как « функция »."
41,"So if you're coding climate — this much CO2, this much O2 creates a recipe — you're coding the expression of that plant, the nutrition of that plant, the size of that plant, the shape, the color, the texture.","Так что если программировать климат — столько-то CO2, столько-то O2 по рецепту — вы кодируете характеристики растения, его питательные свойства, его размер, форму, цвет, текстуру."
42,"And so we had our first meeting, after three months, in Tiburon, which is just up the road from here — you know Tiburon?","Итак, наша первая встреча состоялась спустя три месяца в Тибуроне, что находится здесь, совсем рядом — вы же знаете Тибурон?"
43,"Take it a bit further than just cleaning our living room, where maybe we make it to sort like a life hygiene.","Смотря на это чуть шире, чем просто как на уборку в доме, возможно, мы сможем достичь чего-то вроде гигиены жизни."
44,"You can also see that his visual cortex is activated in the back of the head, because that's where he's seeing, he's seeing his own brain.","Вы видите, что в задней части головы активирована зрительная кора головного мозга, потому что ею он видит, видит свой собственный мозг."
45,"Of course, it was also a hard and sometimes frustrating time, but we were sitting together in the lab, or occasionally in the café, sharing our sadness about the end of our project as well as the joy in our work.","Конечно, это было тяжёлое время, иногда у нас почти опускались руки, но мы сидели вместе в лаборатории, или, скажем, в кафе, разделяя как печаль от скорого окончания проекта, так и наслаждение от работы."
46,"The book ""A Thousand Places To See Before You Die"" lists Coeur d'Alene — it's a gorgeous paradise for huntsmen, boatmen and fishermen.","В книге « Тысяча мест, которые нужно увидеть перед смертью » есть Кёр-д ’ Ален — это рай для охотников, любителей лодочных прогулок и рыбаков."
47,"If we're going to look for these stealth black holes at the center of galaxies, the best place to look is in our own galaxy, our Milky Way.","Если мы хотим взглянуть на эти хитрые чёрные дыры в центре галактик, то лучшее место — это наша собственная галактика, наш Млечный Путь."
48,"I do wish, with their budget, that they might have spent just a tiny bit more money to pay a consulting fee to some poor, starving graduate student, who could have told them that those are the eyes of a fish that's been preserved in formalin.","Мне бы хотелось, чтоб, при их финансовых возможностях, они могли бы потратить немного больше, оплатив консультационные услуги какого-нибудь бедного, голодающего студента, который мог бы сообщить им, что это - глаза рыбы, сохраненной в формалине."
49,"Its creator, who is an Egyptian TV producer called Ahmed Abu Haïba, wants young people to be inspired by Islam to lead better lives.","Его создатель - египетский ТВ продюссер по имени Ахмед Абу Хаиба, хочет, чтобы молодые люди вдохновлялись исламом на пути к лучшей жизни."
50,"And the Chinese then, in one of their periods of media openness, decided that they were going to let it go, that they were going to let this citizen reporting fly.","Китай, в период краткосрочной гласности, решил закрыть на это глаза и позволить гражданам вести репортажи с места событий."
51,"What happened, apparently, is during the first bounce, somewhere, we hit the edge of a crater with one of the legs of the lander, and the rotation velocity of the lander changed.","Похоже, что во время первого отскока модуль как-то задел одной из посадочных опор край кратера, и вектор его угловой скорости поменялся."
52,"What we do is put very small GPS collars on these animals to study how they move together, and what this has to do with their social structure.","Мы одели крошечные GPS ошейники на этих животных, чтобы изучить, как они перемещаются вместе и как это соотносится с их социальной структурой."
53,"A woman came on the fourth day and approached her and asked her to take another child — a little boy, just four years old.",На четвёртый день к ней приблизилась женщина и попросила взять ещё одного ребёнка — маленького четырёхлетнего мальчика.
54,"Then I thought, ""Why not make a Google Map, but in the physical world?"" Rather than typing a keyword to find something, I put my objects on top of it.","Затем я подумал, « Почему бы мне не перенести Google Map в физический мир? » Вместо того чтобы набирать на клавиатуре поисковый запрос, я поместил предметы на неё."
55,And then we would put all of this into place in one neighborhood in what was the worst police district in the United States at the time.,"Мы начали нашу работу в одном районе, который был худшим полицейским округом в Соединенных Штатах в то время."
56,"So here I had the hope that by inserting some natural elements, if you want — some fog — I could make the space tangible.","И поэтому я надеялся, что добавив некоторые естественные элементы такие, как дым, я сделаю пространство осязаемым."
57,"I mean, first of all, a lot of people who look at risk and look at the numbers don't understand this belief that terrorism is still the number one threat.","Прежде всего, многие их тех, кто смотрит на риски и на статистику, не могут понять, почему терроризм всё ещё считается « угрозой № 1 »."
58,"We have thousands and thousands of European fighters in Syria and in Iraq, so this is not something that you solve by just not allowing Syrians to come in.","Тысячи и тысячи боевиков из Европы теперь в Сирии и Ираке, и эту проблему нельзя разрешить, просто запретив въезд сирийцам."
59,"So our job as humans is to parent our mind children, to find them good friends, to find them a good job.","Наша задача как людей — быть хорошими родителями для порождений нашего разума, находить им хороших друзей, находить им достойное занятие."
60,"Poisoning is happening to flocks that like to stick together, especially in places like rice schemes.","Отравление случается в стаях, которые любят держаться вместе, особенно в таких местах, как рисовые поля."
