,en,ru
466,"We solved it with Leed Certification, where we said this is a different kind of building that stood for different values of environmental sustainability.","Мы решили её с Leed Certification, когда сказали, что это другой тип зданий — он поддерживает экологическую устойчивость."
467,"They are much more like you than you would believe, so try not to compare your insides to other people's outsides.","Они намного больше похожи на вас, чем вы думаете, поэтому не сравнивайте то, что у вас внутри, с тем, что у других снаружи."
468,"And the interesting moment now, the number of environments where the social design challenge relies on both of those things being true.","И особенно примечательно то, как много мест и регионов, в которых социальное устройство находясь под угрозой, решает свои проблемы, рассчитывая на наличие обоих этих факторов."
469,"Anything else would run contrary to our values, it would run contrary to the wishes of the people on the ground, it would run contrary to our interests.","Любое другое пойдёт вопреки нашим ценностям, вопреки желаниям местных жителей, вопреки нашим интересам."
470,Life Magazine helped in this effort by announcing the introduction of throwaways that would liberate the housewife from the drudgery of doing dishes.,"Журнал Life помог этому, когда объявил введение одноразовой тары, которая якобы освободит домхозяйку от нудного мытья посуды."
471,"They used to aggregate up to the tens of thousands, 30,000 groupers about this big in one hectare, in one aggregation.","Десятки тысяч, 30000 черн такого размера совокуплялись одновременно на одном гектаре в одном акте совокупления."
472,"So in Africa, we have this extraordinary opportunity right now, an extraordinary opportunity, to change the world and create an energy system that everybody will be jealous of, and everybody will look to us as the innovators of.","Итак, в Африке уже сейчас есть эта удивительная возможность, потрясающая перспектива изменить мир и создать энергосистему, которой все будут завидовать, и для всех мы будем первооткрывателями."
473,"So if we're going to create a change, if we're going to create a world where we all have those kinds of opportunities, then choose to open doors for people.","Итак, если мы хотим изменений, если мы хотим создать мир, в котором у всех есть такие возможности, тогда откройте двери для людей."
474,"Not just because of the cesspools, but also the sheer number of livestock in the city would shock people.","Не только из-за сточных колодцев, но также из-за невероятного количества домашнего скота, находящегося в городе."
475,It's finding those opportunities that will unleash the greatest possibility we have to actually address these social problems because we can scale.,"Это поиск таких возможностей, которые высвободят величайшую возможность, которая есть у нас — на самом деле решить эти общественные проблемы, потому что мы можем масштабировать."
476,"And in order to explain interaction, we need to really bring people in and make them realize how interaction is part of their lives.","Для того чтобы объяснить взаимодействие, нам действительно надо собрать людей и дать им понять, какое место оно занимает в их жизни."
477,"And the lifetime we finally obtained for our materials was on one level with already commercialized materials for green OLEDs at the time, and we achieved this within just one year.","И срок работы наших материалов, которого мы в итоге добились был на одном уровне с уже продававшимися тогда материалами для зелёных OLED, и мы добились этого всего за год."
478,"So what we really want to focus on is the long-run evolution of wealth inequality, and what's going to happen in the future.","Нам действительно стоит подумать об изменениях в неравном богатстве в долгосрочной перспективе, и том, что будет дальше."
479,"And — I gave a talk in New York a couple months after this, and afterwards somebody came up to me and they said that — they actually emailed me — and they said that they appreciated the talk, and when they got back to their car, they found a note on their car that made them think maybe New York was getting back to being New York again after this event — it had been a few months.","И … Я выступал в Нью-Йорке через пару месяцев после этого, и после выступления один человек подошел ко мне и сказал, что … они, вообще-то, написали мне и сказали, что они благодарны за выступление, и что когда они возвращались к машине, они обнаружили на ней надпись, которая заставила их подумать, что Нью-Йорк снова становится Нью-Йорком после этого события, хотя прошло только несколько месяцев."
480,"Well the car that's one or two blocks from your home or your office is probably your neighbor's car, and it's probably also available.","Знаете, машина в одном-двух кварталах от вашего дома или офиса скорее всего принадлежит вашему соседу, и скорее всего, она доступна для использования."
481,"They then recur, I give them that same drug over 96 hours by continuous infusion, another 20 or 30 percent will respond.","История повторяется, я прописываю то же лекарство в течении 96 часов продолжительного приема, другие 20 или 30 процентов ответят на лечение."
482,"Well the good news is that the developing world, but frankly, the whole world, is busy building, and starting to build, nuclear reactors.","Позитивная сторона состоит в том, что развивающиеся страны, в принципе, все страны, либо строят либо начинают строить ядерные реакторы."
483,"And my wish, when I see those women, I meet those farmers, and I think about all the people across this continent who are working hard every day, is that they have that sense of opportunity and possibility, and that they also can believe and get access to services, so that their children, too, can live those lives of great purpose.","И я хочу, когда я вижу этих женщин, встречаюсь с фермерами, или думаю про всех тех людей во всех частях этого континента, которые тяжело работают каждый день, хочу, чтобы у них было это чувство благоприятного случая и возможности, чтобы у них была вера в себя, доступ к необходимым услугам, чтобы их дети могли также жить жизнь с большими целями."
484,And what we learn can lead us to new kinds of robotic flyers that can expand our vision of important and remote places.,"Это знание приводит нас к новым видам роботизированных летательных аппаратов, которые расширяют наше видение важных и отдалённых мест."
485,There are no words adequate to denounce the al Shabaab terrorists who attacked the Westgate Mall in Nairobi on the same day as a children's cooking competition in September of 2013.,"Не найдётся подходящих слов, чтобы осудить террористов Аль Шабаб, атаковавших торговый центр « Уэстгейт » в Найроби в тот же день, что и детское кулинарное состязание, в сентябре 2013 года."
486,"So the storyline here for both our OLED story and Star Trek is actually the basic setting for a lot of breakthrough stories, in and out of science.","Так что сюжетная линия обеих историй на самом деле довольно стандартна для множества историй прорывов, в науке и вне её."
487,"So I called Barry, and with his blessing, in October 1995 walked into the waiting room of the pediatrics clinic at Boston Medical Center.","Я позвонила Барри, и с его благословения в октябре 1995 года я вошла в комнату ожидания отделения педиатрии в Медицинском Центре Бостона."
488,"It has its own external prosthetic devices, and these devices are helping us all to communicate and interact with each other.","У него свои внешние вспомогательные устройства, и эти устройства помогают нам всем общаться и взаимодействовать друг с другом."
489,"Beauty is an adaptive effect, which we extend and intensify in the creation and enjoyment of works of art and entertainment.","Красота - это механизм приспособления, который мы развиваем, и усиливаем, создавая и наслаждаясь произведениями искусства."
490,"One of my favorite studies found that the more willing a husband is to do housework, the more attractive his wife will find him.","Согласно одному из моих любимых исследований, чем больше муж хочет делать что-то по дому, тем привлекательнее он кажется жене."
491,"So when I think, like, what is the fundamental good of a company like Tesla, I would say, hopefully, if it accelerated that by a decade, potentially more than a decade, that would be quite a good thing to occur.","Когда я размышляю, что важного Tesla может дать миру, я надеюсь, что если мы ускорим появление устойчивой энергетики на 10 или более лет, мы добьёмся своей цели."
492,It was something very similar to the phase transition that occurs when water turns into ice below zero degrees.,"Это было очень похоже на фазовый переход, происходящий, когда вода становится льдом при температуре ниже нуля."
493,"So here you see this iconic entrance in which we would literally peel up the street and reveal the historical layers of the city, and invite people into this warm underground space.","Вот знаковый вход, где мы буквально приподнимаем тротуар, обнажаем исторически сложившиеся пласты города и приглашаем прохожих в этот тёплый подземный уголок."
494,"One, I have an unusually high tolerance for risk, and the other is I have a good sense, a good intuition about what will happen in the future, and I think that that intuition about the future is the essence of good entrepreneurship.","Во-первых, я необычайно спокойно отношусь к риску, Во-вторых, я обладаю хорошей интуицией о том, что случиться в будущем, и я думаю, что эта интуиция является самой сутью предпринимательства."
495,"This comet had to be specially selected because A, you have to be able to get to it, and B, it shouldn't have been in the solar system too long.","Комету нужно было отобрать среди других, потому что нужна такая, до которой можно добраться, и она не должна была находиться в Солнечной системе слишком долго."
496,"We have a new organization together called The Institute for Figuring, which is a little organization we started to promote, to do projects about the aesthetic and poetic dimensions of science and mathematics.","Вместе мы основали « Институт Соображения », он небольшой, и мы создали его для того, чтобы продвигать проекты об эстетическом и поэтическом измерениях науки и математики."
497,"Once again, we seem to be failing to have an appropriate emotional response to what we have every reason to believe is coming.","Опять же, нам не удаётся выстроить подобающую эмоциональную реакцию на то, что по всем признакам нам предстоит."
498,We are so connected that we must treat each other as if an action toward you is an action toward myself.,"Мы все объединены и нам нужно обращаться друг с другом так, как если бы действие, обращённое к вам было бы действием, обращённым к себе."
499,"My team and I will have batch-processed large amounts of satellite data using algorithms in order for you to find things, so you'll be doing really good science.","Мы с моей командой будем предоставлять информацию со спутников, обработанную через алгоритмы для поиска объектов, так что вы действительно станете учёными."
500,"And that gut instinct is so powerful, it can make even the most reasonable and measured of us come up with mysteries and conspiracy theories where none exist.","Внутренний голос настолько силён, что даже самые рассудительные из нас сочиняют загадочные теории, которые не имеют ничего общего с реальностью."
501,"And that's what I want everyone in here to feel like, the Incredible Hulk, at the end of this presentation.","И вот чего я хочу здесь - чтобы все почувствовали себя также, почувствовали себя Невероятными Халками к концу презентации."
502,"Some part of you is cold, and so another part may truly enjoy what it is to be warm, or even to be cold.","Какая-то часть вас остаётся в холоде, чтобы другая часть могла по-настоящему ощущать, что такое тепло или даже холод."
503,"We go into the prisons, train them, give them skills, tools and support to enable them to be able to change their mindsets, their behaviors and their attitudes.","Мы идём в тюрьмы и проводим тренинги, даём им навыки, инструменты и поддержку, чтобы они смогли изменить своё мышление, поведение и отношение."
504,"I heard from Nathan Myhrvold — and I think here's the action point — it'll take an act of Congress to make the Nuclear Regulatory Commission start moving quickly on these small reactors, which we need very much, here and in the world.","Я слышал от Натана Мирвольда – тут, думаю, простор для реальных действий – о том, что необходимо решение Конгресса США для быстрых шагов Комиссии по ядерным реакторам в отношении малых реакторов, которые очень нужны нам здесь, да и по всему миру."
505,"And if you see the benefits of the mangrove in terms of the storm protection and cyclone protection that you get and in terms of the fisheries, the fish nurseries, that provide fish for the poor, that answer is more like $11,000.","И если посчитать все выгоды, которые приносят мангровые деревья в виде защиты от ураганов и циклонов, а также для рыбопитомников и рыболовства, что снабжают бедных рыбой, то их ценность повышается до $11,000."
506,"We can say that because of them, because of their forefathers, India could get the first engineering college in 1847.","Мы можем сказать, что благодаря им, благодаря их предшественникам Индия смогла получить первую инженерную школу в 1874 году."
507,"There is the quickest way advances are likely to occur, as measured in discoveries per investigator per year.","Это самый быстрый способ достижения успеха, если учитывать открытия на одного учёного в течение года."
508,Imagine that a group of your biggest skeptics are camped in the heart of your organization asking the toughest questions and they can see everything inside of your organization.,"Представьте, что группа крупнейших скептиков разбила лагерь в центре вашей организации, задаёт вам труднейшие вопросы и они видят всё, что есть внутри вашей организации."
509,"So one of the problems suggested with nonlethal weapons is that they might be used indiscriminately — that you would use them against a whole range of people, because you don't have to worry so much anymore.","Поэтому внедрение ОНД сопряжено с одной проблемой — оружие такого типа могут начать использовать когда ни заблагорассудится, против кого угодно, ведь возможные последствия уже не так страшны."
510,"However, this isn't a real photograph, but a computer graphic rendering — an artistic interpretation of what a black hole might look like.","Однако это не настоящая фотография, а всего лишь компьютерная графика, художественная интерпретация того, как чёрная дыра могла бы выглядеть."
511,"Because your fuel is liquid, and it's combined with your coolant, you could actually just drain the core into what's called a sub-critical setting, basically a tank underneath the reactor that has some neutrons absorbers.","Так как топливо жидкое, и оно взаимодействует с охладителем, можно просто слить активную часть в так называемую субкритическую установку, такой резервуар под реатором, у которого есть поглотители нейтронов."
512,"And after I'd worked out how to fit reading and blogging about, roughly, four books a week around working five days a week,","Разобравшись, как совместить чтение и публикации в блоге приблизительно о четырёх книгах с пятидневным рабочим графиком,"
513,"And the bus is taken with a cargo-scanning X-ray, which is the sort of machine you have on borders, which checks for contraband and drugs and bombs and things.","И автобус был снят грузовым рентгеновским сканером, который используется на границах для поиска контрабанды, наркотиков, бомб и разных вещей."
514,"There's very little room in the cranial vault, only a few millimeters, and it's filled entirely with cerebral spinal fluid, which acts as a protective layer.","В своде черепа очень мало места, всего несколько миллиметров, и оно целиком заполнено спинно-мозговой жидкостью, выступающей в качестве защитной прослойки."
515,"If any of you thinks you want to help me in any way to achieve what is a fairly impossible and implausible dream still at this point, please let me know.","Если кто-то из вас думает, что хочет помочь мне как-то достичь того, что выглядит невозможным и неправдоподобным сейчас, пожалуйста, дайте мне знать."
516,"We've mapped the afterglow with spectacular precision, and one of the shocks about it is that it's almost completely uniform.","Мы определили место послесвечения с потрясающей точностью и шокирует здесь в частности то, что оно совершенно универсально."
517,I started my firm to help communities across the country realize their own potential to improve everything about the quality of life for their people.,"Я создала свою фирму, чтобы помочь сообществам по всей стране реализовать их собственный потенциал во всех аспектах улучшить качество жизни их людей."
518,"What Dan Dennett said the other day — having a curriculum where they study different religions, just to make a mental flexibility, give them a mental flexibility in different belief systems — I think this is so necessary in our world today as you see these clash of beliefs taking place.","Как недавно сказал Дэн Деннет, нужна программа, где будут изучаться разные религии; чтобы обеспечить гибкость ума, гибкость в отношении разных систем взглядов."
519,"So, with that, in turn, 20 million dollars today does this; 20 years from now we'll make Star Trek replicators that make anything.","В свою очередь, за 20 миллионов долларов теперь это делается; через 20 лет мы сделаем репликаторы как в фильме « Звёздный путь », которые делают всё что угодно."
520,"This summer, we launched Citi Bike, the largest bike share program in the United States, with 6,000 bikes and 330 stations located next to one another.","Этим летом мы запустили программу City Bike, самую крупную программу в США, предоставив в общественное пользование 6 000 велосипедов."
521,"So I asked people whether they had basic audio capabilities, just so they could sing along to the song with headphones on, so I could just get their voices back.","И я попросил людей, независимо от их вокальных данных, подпевать этой песне, слушая ее в наушниках, чтобы я смог собрать их голоса."
522,It's a commission brought together by former UK Prime Minister and UN Special Envoy for Global Education Gordon Brown.,Это комиссия под управлением бывшего премьер-министра Великобритании и специального представителя ООН по всемирному образованию Гордона Брауна.
