,en,ru
236,"These foreign fighters had left their families in the Gulf, the Levant and North Africa to join al Qaeda in Iraq.","Эти иностранные боевики оставили свои семьи в Персидском заливе, Леванте и Северной Африке, чтобы присоединиться к Аль-Каиде в Ираке."
237,"And it was [unclear] Tata Trust, which gave me six rupees per month, almost a dollar per month for six years.","И тогда благотворительный фонда Тата Траст стал оказывать мне помощь в размере 6 рупий в месяц, это почти доллар в месяц в течении шести лет."
238,You can fundamentally change your reaction to things so that it allows you to go places and see things and do things that otherwise would be completely denied to you,"Можно коренным образом изменить свою реакцию на происходящее, что позволит отправляться куда угодно, и видеть, и делать то, что, в противном случае, было бы для вас абсолютно недоступно"
239,"Now, we don't know how the neurons in the brain are organized to form networks, and we don't know how the biomolecules are organized within neurons to form these complex, organized machines.","Сейчас мы точно не знаем, как организованы нейроны в мозге, как они формируют сети, и мы не знаем, как биомолекулы организованы в нейронах и как они формируют эти сложноорганизованные машины."
240,"In a recent study that was produced out of Dalhousie University, it was found that dragging for shrimp is one of the most carbon-intensive ways of fishing that you can find.","В недавнем исследовании, проведённом университетом Далхауси, было обнаружено, что ловля креветок — один из самых углеродоёмких видов рыболовства в мире."
241,"We're funded by donations from the public, and one of the more interesting things about that is how little money it actually takes to run Wikipedia.","Проект финансируется за счет добровольных пожертвований, и, что интересно, как мало на самом деле нужно денег, чтобы поддерживать википедию."
242,"She said she loved the sound of my project, could she go to her local English-language bookshop and choose my Malaysian book and post it to me?","Она сказала, что ей понравилась идея моего проекта и что она может пойти в местный англоязычный магазин, выбрать для меня малазийские книги и отправить их мне."
243,"So more and more we're trying to find ways for people to actually author things inside of the museums themselves, to be creative even as they're looking at other people's creativity and understanding them.","Так мы поощряем людей создавать что-то своё внутри музея, быть творческими, даже когда они смотрят на работы других людей."
244,"The term ""manipulative,"" often charged against women in a derogatory way, reflects a reality in which women have often had to find ways other than direct confrontation to achieve their goals.","Термин « интриганка », часто уничижительно применяемый в отношении женщин, отражает реальность, в которой женщины научились находить способы, отличные от прямого сопротивления, для достижения своих целей."
245,"In study after study, in countries ranging from Bangladesh to the United States, between 20 and 60 percent of the people in the sex trade who were surveyed said that they had been raped or assaulted by the police in the past year alone.","В исследовании за исследованием в странах от Бангладеша до США от 20 до 60% опрошенных людей, занятых в секс-торговле, сообщают, что были изнасилованы или подвергались нападению со стороны полиции только за последний год."
246,"What is real love? How does it work? In order to work on this question and to figure out how someone goes from meeting on a date to having a life together, Stacey and I went to Sun City Summerlin, which is the largest retirement community in Las Vegas.","Что такое истинная любовь? Как она работает? Чтобы разобраться в этих вопросах и понять, как отношения развиваются от свидания до долгих лет совместной жизни, мы со Стейси отправились в Сан-Сити Саммерлин — самый крупный интернат для пожилых людей в Лас-Вегасе."
247,"Influenced by comics and heavy metal, Nychos inserts a very youthful and enticing energy into anatomy that I just love.","Под воздействием комиксов и хэви-метал Найкос вселяет молодёжную и позитивную энергию в анатомию, и мне это очень нравится."
248,"Hopefully you can appreciate the device going through the patient's body removing bone marrow, not with 200 punctures, but with a single puncture, under local anesthesia.","Надеюсь, вы сможете оценить устройство, которое проникает в организм пациента, повторяя изгибы кости и собирая костный мозг всего через одну пункцию под местной анестезией, а не через 200 проколов."
249,"And every seven sets of seven years, the land gets an extra year of rest during which time all families are reunited and people surrounded with the ones they love.","И через каждые 49 лет давайте земле лишний год отдыха, во время которого все семьи объединяются и пребывают в окружении любимых людей."
250,"I'm asking about our human ancestry, things that we would recognize as being like us if they were sitting here in the room.","Я спрашивал о наших человеческих предках, тех, которых мы бы приняли за себе подобных, если бы они сидели здесь с нами."
251,"The great University of California university system, the great things that have gone on, won't happen.","Великой университетской системы Калифорнийского университета, великих дел, свершающихся там, больше не будет."
252,"My big idea is a very, very small idea that can unlock billions of big ideas that are at the moment dormant inside us.","Моя важная идея очень-очень проста, но она - ключ к миллиарду важных идей, которые сейчас спят внутри нас."
253,"It's a simple illustration of how online trust will change our behaviors in the real world, make us more accountable in ways we cannot yet even imagine.","Это простой пример, как, возникнув в Сети, доверие будет менять наше поведение в реальном мире, делая нас более ответственными способами, которые мы пока даже представить себе не можем."
254,And so the marketization of everything sharpens the sting of inequality and its social and civic consequence.,И поэтому маркетизация всего усиливает боль от неравенства и вытекающие из него социальные и гражданские последствия.
255,"I do run a kind of a business — I've got 120 people and you've got to pay them, so there's a lot of responsibility involved — but the actual work on the project is with, I think, a healthy insecurity.","У меня свой собственный бизнес — на меня работают 120 человек, им нужно платить, поэтому тут много ответственности — но сама работа над проектом сопряжена, как я думаю, со здоровым риском."
256,"The best available answer is that they were literally the earliest known works of art, practical tools transformed into captivating aesthetic objects, contemplated both for their elegant shape and their virtuoso craftsmanship.","Наиболее доступным ответом будет предположение о том, что они представляют собой наиболее ранние из известных произведений искусства, орудия труда, приобретшие художественное очарование, имеющие ценность благодаря не только изящной форме, но и мастерскому исполнению."
257,"I have Asperger's, a high-functioning form of autism that impairs the basic social skills one is expected to display.","У меня синдром Аспергера — высокофункциональная форма аутизма, которая затрудняет ожидаемые от обычных людей навыки общения."
258,"And that was because the computer could make decisions much faster, it could process a lot more information and it can process decisions much more — less emotionally.","Причиной была скорость, с которой компьютеру удавалось обрабатывать массу информации, и его неэмоциональность в принятии решений."
259,"A combination of biomass, aquifers, burning vegetable oil — a process that, quite interestingly, was developed in Eastern Germany, at the time of its dependence on the Soviet Bloc.","Комбинация биомассы, аквифера, растительного масла — процесс, интересно заметить, разработанный в Восточной Германии, во времена зависимости от Советского блока."
260,"So we're currently doing clinical tests, and if these clinical tests commence and our data holds up, we might be able at some point to take this kind of technology and take it out of the Stanford clinic and bring it to the entire world, places where Stanford doctors never, ever set foot.","Сейчас мы проводим клинические испытания, и если они начнутся и подтвердят наши данные, возможно, мы когда-то сможем вооружиться этой технологией, взять её из Стэнфордской клиники и предоставить её всему миру, в места, куда не ступает нога докторов из Стэнфорда."
261,"We are committed to healing ourselves, to lacing up our sneakers, to walking out of our front door every single day for total healing and transformation in our communities, because we understand that we are in the footsteps of a civil rights legacy like no other time before, and that we are facing a health crisis like never ever before.","Мы преданны идее самоисцеления, мы зашнуровываем кроссовки и выходим из дома каждый день, чтобы исцелить и изменить наше сообщество, потому что мы понимаем, что идём по стопам наследия защиты гражданских прав как никогда раньше, и что сейчас мы стоим перед кризисом здоровья нации."
262,So there's an opportunity to create full-spectrum training sets that reflect a richer portrait of humanity.,"Есть возможность создавать полный спектр тренировочных наборов, которые отражают более насыщенный портрет человечества."
263,"The objects we use, the clothes we wear, the houses we live in, all have a profound impact on our behavior, health and quality of life.","Вещи, которые мы используем, одежда, которую носим, дома, в которых живём — всё это имеет огромное влияние на наше поведение, здоровье и качество жизни."
264,"And in one of my absolutely favorite moments, Justice Sotomayor proclaimed isolated DNA to be ""just nature sitting there.""","И один из моих самых любимых моментов, Судья Сотомайор провозгласила, что изолированная ДНК « и есть сама природа »."
265,We will get where we're going faster and society will recapture vast amounts of lost productivity now spent sitting in traffic basically polluting.,"МЫ быстрее достигнем целей и общество вернёт огромное количество потерянной продуктивности, которую мы тратим сейчас, сидя в пробках загрязняя воздух."
266,"Even if you go to West Africa, you notice that market activity in West Africa has always been dominated by women.","Даже в Западной Африке можно заметить, что господствующее положение на рынке там всегда занимали женщины."
267,"It's a dynamic in which to succeed, players have to do something at a predefined time, generally at a predefined place.","Чтобы достичь успеха в этом игровом элементе, игроки должны сделать что-либо в предписанное время, и, как правило, в предписанном месте."
268,"How are those resources really created, the resources we're going to need to deal with all these societal challenges?","Как эти ресурсы на самом деле создаются, ресурсы, которые нам понадобятся для работы со всеми этими социальными вызовами?"
269,"One day when I was only seven years old and fishing, I pulled a ""pinfish,"" they're called, with sharp dorsal spines, up too hard and fast, and I blinded myself in one eye.","Однажды, когда мне было всего 7 лет, я был на рыбалке, и поймал лагодона или он ещё называется « колючий чоп », с острыми шипами на спине, достаточно крепко и быстро, и я ослепил себя на один глаз."
270,"That candle would burn for 15 minutes, 15 minutes of precious light, and then they would take it away, and I returned to darkness.","Эта свеча горела 15 минут, 15 минут драгоценного света, и после они уносили её с собой, а я возвращался в темноту."
271,But there was a really interesting regulation which was they had to put a backseat light — install it in every Jitney — to stop a new pernicious innovation which they called spooning.,"Был ещё один интересный закон, по которому на заднем сиденье должен был быть фонарь в каждом джитни, чтобы помешать парочкам заниматься вот этим."
272,"And about halfway down the peninsula on the Pacific side lies San Ignacio Lagoon, a critical calving ground for gray whales.","На полпути к полуострову со стороны Тихого океана находится лагуна Сан Игнасио — место, где серые киты выводят потомство."
273,"Google showed that it is possible to find information by using a computer algorithm, and this algorithm is based on machine learning.","В Google доказали, что можно находить информацию с помощью компьютерного алгоритма, а этот алгоритм был основан на машинном обучении."
274,"And if we're to make progress with the sustainability revolution, I believe there are three really big changes we need to bring about.","И если мы хотим достичь успеха во внедрении модели экологически рационального развития, я уверен, что нужно произвести три глобальных изменения."
275,"As a born-in-the-mid-1960s Gen X-er, hurtling all too quickly to my fortieth birthday, I'm naturally inclined to pessimism.","Мне, как представителю ""Поколения Х"", родившемуся в середине 60-х и слишком быстро разменявшему пятый десяток, вполне естественно быть пессимистом."
276,"Every time a young baby learns something new — to focus its eyes, to mimic a movement or a facial expression, to pick something up, to form a word or to sit up — new synaptic connections are being built in the brain.","Каждый раз, когда ребёнок учиться чему-то новому — фокусировать свой взгляд, повторять движение или мимику, брать в руки, формулировать слово, или сидеть — в мозгу создаются новые синаптические соединения."
277,"And when someone accesses your medical record, a research doctor, they could see, you could see which doctor accessed it and why, and you could maybe learn about what conditions you have.","Когда врач-исследователь просматривает твою медицинскую документацию, ты можешь видеть, что это за доктор и для чего ему это, и, возможно, тебе станет более понятно твоё медицинское заключение."
278,"And of course, as I mentioned before, since we can now start to map brain function, we can start to tie these into the individual cells.","И конечно же, как я отметил ранее, поскольку мы сейчас можем начать составлять карту функций мозга, мы можем связать их с отдельными клетками."
279,"Many Whitopians feel pushed by illegals, social welfare abuse, minorities, density, crowded schools.","Многие жители « Уайтопии » чувствуют себя ущемлёнными из-за нелегалов, злоупотреблений с социальными пособиями, из-за меньшинств и переполненных школ."
280,"Now, in Ethiopia, we're in the process of designing the first organized Ethiopia Commodity Exchange.","Сейчас, в Эфиопии, мы находимся в процессе разработки первой организованной Эфиопской товарной биржи."
281,"So one approach we ’ re taking is to try to design drugs that function like molecular Scotch tape, to hold the protein into its proper shape.","И один из используемых нами подходов — это попытка разработать лекарства, которые бы работали, как молекулярный скотч, удерживая белки в их правильной форме."
282,"In fact, they were so rare that elected members of Parliament had the right to allocate 15 telephone lines as a favor to those they deemed worthy.","Это было такой редкостью, что депутат Парламента получал право на 15 телефонных линий для передачи, в качестве льготы для тех, кого считал достойным этого."
283,"So if you look, as I did, through this tour, and by looking at about a hundred case studies of different social entrepreneurs working in these very extreme conditions, look at the recipes that they come up with for learning, they look nothing like school.","Так что если вы увидите то, что увидел я во время этой поездки, и потом просмотрите сотню исследовательских отчетов социальных предпринимателей, работающих в таких, чрезвычайно экстремальных, условиях, увидите рецепты обучения которые они разработали, вам покажется, что это вообше не школа."
284,"And, you know, it's no accident that those who run and work in the institutions that are supposed to support Ella and her family don't talk about relationships, because relationships are expressly designed out of a welfare model that was drawn up in Britain and exported around the world.","И не случайно то, что руководители и сотрудники тех учреждений, которые должны помогать Элле и её семье, не говорят об отношениях, потому что отношения явно не вписываются в разработанную модель социального обеспечения, широко заимствованную из Британии."
285,"It's capitalism as it was ultimately meant to be, meeting important needs, not incrementally competing for trivial differences in product attributes and market share.","Это капитализм, каким в конечном счёте он должен быть, удовлетворяющий важные потребности, не конкурирующий постоянно за незначительные различия в свойствах продукта и долю рынка."
286,"Or if it's not so virtuous, you can go into — today, go into any store, put your scanner on a palm onto a barcode, which will take you to a website.","Если он вредоносен, то можно пойти - в наши дни в любой магазин, просканировать штрихкод своим КПК, и попасть на соответствующий веб-сайт."
287,The perpetrators aren't these monsters who crawl out of the swamp and come into town and do their nasty business and then retreat into the darkness.,"Ведь преступники это не такие чудовища, которые лезут из болота, Ведь преступники это не такие чудовища, которые лезут из болота, приходят в город и делают своё грязное дело, а затем скрываются во тьме."
288,"The next stop on my journey was Dallas, Texas, where we learned that barbers were not only willing but fully able to roll up their sleeves and participate in delivering needed health services to improve the health of their customers and their community.","Следующей остановкой на моём пути был Даллас, штат Техас, где я узнал, что парикмахеры не только хотят, но и способны, засучив рукава, принять участие в предоставлении необходимых медицинских услуг на благо своим клиентам и своей общине."
289,"It gives us a completely new view of human origins and what it means to be human, all conventional theories of cultural evolution, of the origin of humans, and what makes us so different from other species.","У нас появляется абсолютно новый взгляд на происхождение человека, и что означает – быть человеком, а также новое представление о традиционных теориях культурной эволюции, о происхождении человека, и в чем именно мы отличаемся от остальных биологических видов."
