,en,ru
746,"At that speed, the surface of the airfoil is the temperature of molten steel — 3,500 degrees Fahrenheit — like a blast furnace.","При такой скорости поверхность планера достигает температуры плавления стали, 2 000 градусов, как в доменной печи."
747,"It turns out that, not only is the Galvao parrot very attractive, useful for headdresses, it evidently has certain hallucinogenic properties, which means that there's a terrible problem with Galvao abuse.","Оказывается, попугай Гальвао не только очень привлекательный, пригодный для головных уборов, он очевидно обладает определёнными галлюциногенными свойствами, что означает, что существует ужасная проблема злоупотребления Гальвао."
748,"To me, the most mind-bending example of the interconnectedness of the ocean comes from an acoustic experiment where oceanographers took a ship to the southern Indian Ocean, deployed an underwater loudspeaker and played back a sound.","Для меня самым завораживающим впечатлением о взаимосвязи океанов стал акустический эксперимент, в ходе которого океанографы отвели корабль в южную часть Индийского океана, установили подводный громкоговоритель и воспроизвели звук."
749,"Accepting death means accepting that we are physical beings who are intimately connected to the environment, as the research on environmental toxins confirms.","Принятие смерти означает осознание того, что мы - физические существа, теснейшим образом связаные с природой, как подтверждает исследование природных токсинов."
750,Which is why it's particularly galling to me as an American that we've been the driving force behind this global drug war.,"Именно поэтому всё это вызывает у меня особую досаду как у американца, потому что, именно мы были движущей силой этой глобальной войны с наркотиками."
751,"So a little over a decade ago, two groups of physicists and astronomers set out to measure the rate at which the expansion of space was slowing down, OK.","Итак, примерно десять лет назад две группы физиков, астрономов, решили измерить скорость, с которой расширение пространства замедляется."
752,"95 percent of the glaciers in the world are retreating or shrinking, and that's because the precipitation patterns and the temperature patterns are changing.",95% мировых ледников отступают или сокращаются в размерах из-за изменения характера выпадения осадков и температурных режимов.
753,"But when I am back in Afghanistan, when I see the students in my school and their parents who advocate for them, who encourage them, I see a promising future and lasting change.","Но когда я возвращаюсь в Афганистан, вижу учащихся в моей школе и родителей, которые поддерживают, подбадривают их, я вижу перспективное будущее и долговременные изменения."
754,"These membranes are also quite similar, morphologically and functionally, to the membranes in your body, and we can use these, as they say, to form the body of our protocell.","Эти мембраны также достаточно похожи, морфологически и функционально, на мембраны в вашем теле, и мы их можем использовать, как говорят, для создания тела нашей протоклетки."
755,"And we found that once we planted this false memory, people didn't want to eat the foods as much at an outdoor picnic.","И мы обнаружили, что как только мы внедрили эти ложные воспоминания, люди перестали есть эти продукты на пикнике на открытом воздухе."
756,So we put together focused nano beam writers and supersonic water jet cutters and excimer micro-machining systems.,"Поэтому мы собрали вместе записывающие устройства на сфокусированных нанолучах, резцы со сверхзвуковой струёй воды и эксимерные микромашинные системы."
757,"So what we've been able to do is to pinpoint where these disturbances are in the brain, and we've been able to intervene within these circuits in the brain to either turn them up or turn them down.","Мы научились с большой точностью определять, где именно находятся эти нарушения, и воздействовать на повреждённые зоны мозга, повышая либо понижая их активность."
758,"And the second implication is that the world will inevitably, as a consequence, become increasingly unfamiliar to us, because it'll be shaped by cultures and experiences and histories that we are not really familiar with, or conversant with.","И вторым последствием является то, что мир неизбежно в результате будет становиться всё менее знакомым для нас, потому что на него будут оказывать влияние культуры, опыты и истории, которых мы знать не знаем и ведать не ведаем."
759,"And I just want to thank the Arduino community for being the best, and just every day making lots of projects.","Я хочу поблагодарить сообщество Arduino за то, что они лучшие, и практически каждый день создают множество новых проектов."
760,When my parents wheeled me out of the hospital I felt like I had been pieced back together like a patchwork doll.,"Когда мои родители выкатили меня из больницы, у меня было ощущение, словно меня собрали из кусочков, как лоскутную куклу."
761,Imaginative literature is not necessarily about writing who we are or what we know or what our identity is about.,"Творческая литература не должна обязательно быть о том, кто мы такие или что мы знаем или о нашей личности."
762,"On this cartography, you're not only able to see and connect from point A to point B the shortest segments, but you're also able to see the happy segment, the beautiful path, the quiet path.","На этих картах вы можете увидеть и найти не только кратчайший путь от точки А к точке Б, но также и самый счастливый, красивый или тихий путь."
763,"Because Ed, like Vineet, understands that our role as leaders is to set the stage, not perform on it.","Эд, как и Винеет, понимает, что их роль в качестве лидеров — это подготовить сцену, а не играть на ней."
764,"Now, what we can do with the spectra? We can actually study line-of-sight velocities of cosmic objects.","Итак, с помощью спектров мы можем изучать скорости движения космических объектов в направлении линии зрительного наблюдения."
765,"We didn't retire and so what happened was, over the next — I would say, 18 months, 19 months, I had this passion to implement some radical policing.","Мы не ушли в отставку, и в следующие полтора года я страстно претворял в жизнь некоторые радикальные методы охраны правопорядка."
766,"Now I'm not suggesting we endow criminals with superpowers, but I am suggesting that we need to find ways to get Joe and people like him to change their brains and their behavior, for their benefit and for the benefit of the rest of us.","Я, конечно, не предлагаю наделить преступников суперспособностями, но я считаю, что нам необходимо найти способ помочь Джо и ему подобным изменить свои мозги и своё поведение, ради их же блага и, конечно, ради нашего блага тоже."
767,"I want it to be enough to have asked and answered 36 questions, and to have chosen to love someone so generous and kind and fun and to have broadcast that choice in the biggest newspaper in America.","Я бы хотела, чтобы было достаточно того, что я задала и ответила на 36 вопросов, что решила полюбить кого-то, столь щедрого, доброго и весёлого, и что распространила информацию об этом в самой известной газете Америки."
768,"As we've said, it's pretty bad for your health, it's bad for those who it affects, and it's not actually good if you're a suicide bomber either.","Продукт вреден для вашего здоровья, вреден для тех, на кого он действует, а также не особо полезен для самих террористов-смертников."
769,"Now, if this system of beautification, sanitation, protection doesn't appeal to you, you are not alone.","Если эта схема облагораживания, санитарии и защиты не вдохновляет вас, не волнуйтесь, вы не одиноки."
770,"Medullary tissue is the calcium build-up, the calcium storage basically, when an animal is pregnant, when a bird is pregnant.","Мозговое вещество состоит из кальция, точнее это место, где кальций хранится во время беременности животного или птицы."
771,"We will soon be using grid computing to do pretty much everything, like adjust the data and everything that goes with the data.","Мы будем использовать грид-системы практически для всего, что включает в себя информацию или с ней связано."
772,"So with my friend Marco, we decided to go there and see who are the real Palestinians and who are the real Israelis.","Мы с моим другом Марко решили поехать туда, чтобы увидеть, кто же на самом деле эти палестинцы и израильтяне."
773,"But everyone that I knew had an interest in the primacy of the written word in terms of nurturing a democracy, nurturing an enlightened life.","Все, кого я знал, профессионально занимались, прежде всего, грамотной письменной речью, в плане привития демократии, привития тяги к просвещенной жизни."
774,"They also provide a significant level of medical care, because they often know a lot about their loved one's condition and needs, sometimes better than the patients themselves, who may be paralyzed or confused by their diagnosis.","Они также в значительной степени оказывают медицинскую помощь, потому что чаще всего они много знают о заболеваниях и потребностях своих близких, иногда лучше, чем сами пациенты, которые могут быть парализованы или не осознавать своего состояния."
775,"I was impressed by, obviously, space and everything about it, but I was most impressed by the engineering that went into it.","Я был увлечён, очевидно, космосом и всем, что с ним связано, но больше всего я был поражён инженерией, которая за всем этим стоит."
776,"And typically when I arrive in a city to do a plan, a plan like this already awaits me on the property that I'm looking at.","Обычно, когда я приезжаю в город, чтобы сделать план, подобный план уже ждёт меня там, где я буду работать."
777,I think this aspect of training in cardiology that the Heart Institute of the Caribbean has introduced in Jamaica is very important in terms of diagnosing cardiac diseases.,"Думаю, что этот аспект обучения в кардиологии, который предоставляет на Ямайке Институт Сердца Карибских островов, очень важен для диагностики сердечно-сосудистых заболеваний »."
778,We believe that this could be the time when the world finally decides that the wanton loss of life in Africa is just no longer acceptable.,"Мы верим, что именно сейчас может стать тем моментом, когда мир наконец-то решит, что бессмысленные людские потери в Африке больше не допустимы."
779,"It matters that women run, and it's time for women to run for office, be it the office of the CEO or the office of the president.","Важно, чтобы женщины баллотировались, пришло время женщинам становиться во главе будь то организации или страны."
780,"While in the third one, in the calling, very much likely I would do it also if I wouldn't be financially compensated for it.","А на третьем уровне, на уровне призвания, я, скорее всего, всё равно занимался бы этой работой, даже если бы мне за неё не платили."
781,"And social business needs markets, and there are some issues for which you just can't develop the kind of money measures that you need for a market.","Социальному бизнесу нужны рынки, но существуют продукты, которым нельзя дать денежную оценку, а именно эта оценка и нужна для функционирования рынка."
782,"So let's say for instance that you're on your way to your best friend's wedding and you're trying to get to the airport and you're stuck in terrible traffic, and you finally arrive at your gate and you've missed your flight.","К примеру, представим, что вы направляетесь на свадьбу лучшей подруги или друга, по дороге в аэропорт застреваете в жуткой пробке, когда наконец-то, вы добегаете до выхода к самолету, оказывается что уже опоздали на свой рейс."
783,"After decades of research and billions of dollars spent in clinical trials, we still have a problem with cancer drug delivery.","После десятилетий исследований и миллиардов долларов, потраченных на клинические испытания, доставки лекарств от рака к клеткам всё ещё остаётся проблемой."
784,"Since the first Web browser was also developed in Urbana, it appears that my hometown in downstate Illinois was the birthplace of much of the virtual, online universe we occupy today.","Так как первый веб-браузер был также разработан в Урбане, похоже, что мой родной город в штате Иллинойс стал местом рождения большей части виртуальной онлайн-вселенной, которую мы знаем сегодня."
785,"Now I put those names in there just for the bacteria buffs, but the main point here is that — there's a lot of them here, I can tell — the main point here is that those data points all show a very strong, positive association between the degree to which a disease organism is transmitted by water, and how harmful they are, how much death they cause per untreated infection.","И я указал эти названия там просто ради тщеславия бактерий, но главным здесь является что их так много, я могу сказать главным является то, что эти точки на графике все указывают на очень сильную, положительную связь между степенью количества переноса организмов по воде и степенью вредоносности этих организмов, какое количество смертей они вызывают на каждую невылеченную инфекцию."
786,"All vertebrates do, and each time a fish species starts to adapt to this dark, cold, cave environment, over many, many generations, they lose their eyes and their eyesight until the end up like an eyeless cavefish like this one here.","У всех позвоночных они есть, но когда рыбы начинают адаптироваться к этой тёмной холодной пещерной среде, поколение за поколением они теряют зрение и глаза, пока в итоге не становятся безглазыми, как вот эта."
787,"Well, there was a girl in the town, and she didn't think they should be in the secret filing cabinets, or if they were, there ought to be a law to allow the children access.","И ещё была одна девочка, которая считала, что им не место в тайных картотеках, а если они и там, должен быть закон, дающий детям право доступа."
788,"And on the flip side, the people who race in are in such a frenzy of anxiety that they don't have original thoughts either.","С другой стороны, те, кто сразу берётся за дело, так неистово нервничают, что у них тоже нет свежих идей."
789,"And yet, despite everything going really well for John, he was struggling, fighting addiction and a gripping depression.","И, несмотря на своё кажущееся везение, Джон не был счастлив он боролся с зависимостью и парализующей депрессией."
790,"So though we may not be skilled at drawing, the point is that we intuitively know how to break down complex things into simple things and then bring them back together again.","Хотя мы можем и не иметь навыков рисования, смысл в том, что мы интуитивно знаем, как разбить сложное на простые элементы, а затем снова собрать их воедино."
791,"Montanans have long-held values, which today seem to be getting in the way of their solving their own problems.","У жителей Монтаны есть давние ценности, которые сегодня, похоже, мешают им решить свои собственные проблемы."
792,"Well, the last product from the book that I'm showing you is renewable energy — actually, to show that my first question, if pigs are still used up until the last bit, was still true.","Итак, последний продукт в книге, который я вам показываю - это возобновляемая энергия — фактически для того, чтобы показать, что мой первый вопрос - до сих пор ли свиньи используются до конца - все еще правда."
793,We showed in a study a few years ago that you can actually match the palm of someone's hand up to the computer mouse that they use routinely with up to 95 percent accuracy.,"Недавно мы описали в исследовании, что по микробиологическому составу ладони можно обнаружить, какой мышкой обычно пользуется человек, с вероятностью до 95%."
794,"And controversial though it was, and even controversial though it remains, Cage's point is that there is no such thing as true silence.","И хотя его творчество было и остаётся очень противоречивым, Кейдж смог убедительно показать, что абсолютной тишины не бывает."
795,"Because when you think of how much data's coming into our brains, we're trying to take in as much data in a day as people used to take in in a lifetime.","Если подумать, сколько информации поступает в наш мозг, то мы пытаемся принять за день столько же, сколько раньше — за всю жизнь."
796,"If all digital data in the world were stored on punch cards, how big would Google's data warehouse be?","Если бы все цифровые данные в мире хранились на перфокартах, какого размера было бы информационное хранилище Google?"
797,You must have near-continuous communication with high-performance computing networks and with others nearby to understand their intent.,"Вы должны иметь непрерывную связь с высокопроизводительными вычислительными сетями и с соседями, чтобы понимать их намерения."
798,"You can't fix that problem without addressing shame, because when they teach those folks how to suture, they also teach them how to stitch their self-worth to being all-powerful.","Эту проблему не решить, не упоминая стыд, потому что когда врачей обучают накладывать швы, их также приучают к мысли о том, что они всемогущи."
799,"Now, why would I suggest that producing drought-tolerant crops will go towards providing food security?","Почему я предполагаю, что производство засухоустойчивых культур укрепит продовольственную безопасность?"
800,"Thousands of years of human evolution has not only given us humans like Tibetans, who can thrive in low-oxygen conditions, but also Argentinians, who can ingest and metabolize arsenic, the chemical element that can kill the average human being.","Тысячелетия эволюции людей дали не только таких людей, как тибетцы, процветающих в условиях пониженной концентрации кислорода, но и аргентинцев, которые могут переваривать и усваивать мышьяк — химический элемент, способный убить среднестатистического человека."
801,"So it immediately cools, and it can no longer hold in suspension all of the material that it's dissolved, and it precipitates out, forming black smoke.","Там она нагревается до огромной температуры, перенасыщается минералами, меняет направление потока и взлетает вверх, извергаясь на поверхность земли, как гейзер в Йеллоустоне."
802,"So, why does good sex so often fade, even for couples who continue to love each other as much as ever?","Итак, почему хороший секс так часто исчезает, даже у тех пар, которые продолжают любить друг друга на протяжении многих лет?"
